"Subject","Start Date","Start Time","Location"
"White Crane Lion Dancers","02/07/2025","5:30 PM","Dining Room"
"Little Gators Preschool Children bring Valentines","02/13/2025","1:00 PM","Dining Room"
"Valentine’s Happy Hour with guest performer TBA","02/13/2025","3:00 PM","Friendship Hall"
"Valentine Sweetheart and Birthday Dinner","02/14/2025","",""
"Sing-along with more songs of the 60s & 70s with Stephen & Margaret Jacobs","02/19/2025","3:00 PM","Friendship Hall"
"Piano Performance: David Saliamonas","02/20/2025","3:00 PM","Morgan Parlor"
